status,issue,primary finding,title,validator 1 comment,validator 2 comment,merged root cause
Unsatisfactory,validation-5,,Any investor can prevent pool from being launched by refunding his tokens,It's being governed by _project.refundDeadline,several DoS vector for pool launch,https://github.com/code-423n4/2024-06-vultisig/blob/main/src/ILOManager.sol#L193C9-L195C10
Unsatisfactory,validation-679,,Attacker can DOS attack by claiming refund for ILOPools,It's being governed by _project.refundDeadline,several DoS vector for pool launch,https://github.com/code-423n4/2024-06-vultisig/blob/main/src/ILOManager.sol#L193C9-L195C10
Unsatisfactory,findings-23,,The `ILOManager.initProject` function can be frontrun,"Analyzer: L-5, L-16",front-running initialization. seems qa,https://github.com/code-423n4/2024-06-vultisig/blob/main/src/ILOManager.sol#L57-L65
Unsatisfactory,findings-29,,Potential Front-Run with a Different `initialPoolPriceX96` to cause DoS,"Analyzer: L-5, L-16",front-running initialization. seems qa,https://github.com/code-423n4/2024-06-vultisig/blob/main/src/ILOManager.sol#L57-L65
Unsatisfactory,findings-3,,Attacker can DoS ILO Creation,"Analyzer: L-5, L-16",front-running initialization. seems qa,https://github.com/code-423n4/2024-06-vultisig/blob/main/src/ILOManager.sol#L57-L65
Unsatisfactory,findings-56,,Frontrunable ILOManager.initProject and no means to delete _cachedProject mappings allows for DOS,"Analyzer: L-5, L-16",front-running initialization. seems qa,https://github.com/code-423n4/2024-06-vultisig/blob/main/src/ILOManager.sol#L57-L65
Unsatisfactory,findings-8,,Project admins can be frontruned by a malicious user when creating a new ILOPool,onlyProjectAdmin,front-running initialization. seems qa,https://github.com/code-423n4/2024-06-vultisig/blob/main/src/ILOManager.sol#L57-L65
Unsatisfactory,validation-106,,Adversaries can front-run initProject function to prevent actual project's owner from launching ILO with the protocol,"Analyzer: L-5, L-16",front-running initialization. seems qa,https://github.com/code-423n4/2024-06-vultisig/blob/main/src/ILOManager.sol#L57-L65
Unsatisfactory,validation-107,,User can be grief attacked when creating a project,"Analyzer: L-5, L-16",front-running initialization. seems qa,https://github.com/code-423n4/2024-06-vultisig/blob/main/src/ILOManager.sol#L57-L65
Unsatisfactory,validation-119,,An attacker can frontrun `initProject()` by calling `initProject()` to DOS `initILOPool()` ,"Analyzer: L-5, L-16",front-running initialization. seems qa,https://github.com/code-423n4/2024-06-vultisig/blob/main/src/ILOManager.sol#L57-L65
Unsatisfactory,validation-128,,Front running attack to initialize function in ILOManager,"Analyzer: L-5, L-16",front-running initialization. seems qa,https://github.com/code-423n4/2024-06-vultisig/blob/main/src/ILOManager.sol#L57-L65
Unsatisfactory,validation-152,,An attacker can call initILOPool first to become admin,onlyProjectAdmin,front-running initialization. seems qa,https://github.com/code-423n4/2024-06-vultisig/blob/main/src/ILOManager.sol#L57-L65
Unsatisfactory,validation-166,,Race Condition in `initialize` Function Leading to Unauthorized Manager Assignment,"Analyzer: L-5, L-16",front-running initialization. seems qa,https://github.com/code-423n4/2024-06-vultisig/blob/main/src/ILOManager.sol#L57-L65
Unsatisfactory,validation-231,,Attacker can squat pool addresses to prevent official deployments and trap users funds,"Analyzer: L-5, L-16",front-running initialization. seems qa,https://github.com/code-423n4/2024-06-vultisig/blob/main/src/ILOManager.sol#L57-L65
Unsatisfactory,validation-281,,initProject() can be frontrun ,"Analyzer: L-5, L-16",front-running initialization. seems qa,https://github.com/code-423n4/2024-06-vultisig/blob/main/src/ILOManager.sol#L57-L65
Unsatisfactory,validation-29,,Malicious user can frontrun initProject() to DoS the honest project,"Analyzer: L-5, L-16",front-running initialization. seems qa,https://github.com/code-423n4/2024-06-vultisig/blob/main/src/ILOManager.sol#L57-L65
Unsatisfactory,validation-302,,Attacker can prevent new Project creation by front-running and cause DoS.,"Analyzer: L-5, L-16",front-running initialization. seems qa,https://github.com/code-423n4/2024-06-vultisig/blob/main/src/ILOManager.sol#L57-L65
Unsatisfactory,validation-31,,Attacker can frontrun initProject() by creating a uniswap pool to completely DoS the project,Intended design,front-running initialization. seems qa,https://github.com/code-423n4/2024-06-vultisig/blob/main/src/ILOManager.sol#L57-L65
Unsatisfactory,validation-312,,ILOManager.sol can be initialized by anybody,"Analyzer: L-5, L-16",front-running initialization. seems qa,https://github.com/code-423n4/2024-06-vultisig/blob/main/src/ILOManager.sol#L57-L65
Unsatisfactory,validation-333,,Attacker can front-run `initProject()` to cause launch to fail,"Analyzer: L-5, L-16",front-running initialization. seems qa,https://github.com/code-423n4/2024-06-vultisig/blob/main/src/ILOManager.sol#L57-L65
Unsatisfactory,validation-367,,Attacker Can Front-Run User's Projects,"Analyzer: L-5, L-16",front-running initialization. seems qa,https://github.com/code-423n4/2024-06-vultisig/blob/main/src/ILOManager.sol#L57-L65
Unsatisfactory,validation-390,,An attacker can frontrun `initProject()` by directly deploying/manipulating the uniswapV3 pool to DOS `initProject()`,"Analyzer: L-5, L-16",front-running initialization. seems qa,https://github.com/code-423n4/2024-06-vultisig/blob/main/src/ILOManager.sol#L57-L65
Unsatisfactory,validation-410,,Malicios user can frontrun call to initProject and cause honest transactions to create a project revert. A party with enough funds can DoS an ILO launch.,"Analyzer: L-5, L-16",front-running initialization. seems qa,https://github.com/code-423n4/2024-06-vultisig/blob/main/src/ILOManager.sol#L57-L65
Unsatisfactory,validation-415,,ILOManager Initializer,"Analyzer: L-5, L-16",front-running initialization. seems qa,https://github.com/code-423n4/2024-06-vultisig/blob/main/src/ILOManager.sol#L57-L65
Unsatisfactory,validation-434,,The `initProject` function should have a modifier that checks if `msg.sender` has proper access,"Analyzer: L-5, L-16",front-running initialization. seems qa,https://github.com/code-423n4/2024-06-vultisig/blob/main/src/ILOManager.sol#L57-L65
Unsatisfactory,validation-468,,Front-running in project initialization will lock ILO pool process creation for uniswapV3 address,"Analyzer: L-5, L-16",front-running initialization. seems qa,https://github.com/code-423n4/2024-06-vultisig/blob/main/src/ILOManager.sol#L57-L65
Unsatisfactory,validation-470,,Denial of Service (DoS) Attack on Project Initialization via Front-Running,"Analyzer: L-5, L-16",front-running initialization. seems qa,https://github.com/code-423n4/2024-06-vultisig/blob/main/src/ILOManager.sol#L57-L65
Unsatisfactory,validation-489,,Anyone can call `initProject()` function to update the project fees and make other critical changes,"Analyzer: L-5, L-16",front-running initialization. seems qa,https://github.com/code-423n4/2024-06-vultisig/blob/main/src/ILOManager.sol#L57-L65
Unsatisfactory,validation-493,,"frontrunning every call to ""initProject"" will avoid any creator from using it","Analyzer: L-5, L-16",front-running initialization. seems qa,https://github.com/code-423n4/2024-06-vultisig/blob/main/src/ILOManager.sol#L57-L65
Unsatisfactory,validation-50,,Anyone can become manager of a pool,"Analyzer: L-5, L-16",front-running initialization. seems qa,https://github.com/code-423n4/2024-06-vultisig/blob/main/src/ILOManager.sol#L57-L65
Unsatisfactory,validation-555,,Attacker can frontrun creator of project to deny admin ownership,"Analyzer: L-5, L-16",front-running initialization. seems qa,https://github.com/code-423n4/2024-06-vultisig/blob/main/src/ILOManager.sol#L57-L65
Unsatisfactory,validation-574,,"`ILOManager::initialize` misses `onlyOwner` modifier, and a malicious user can frontrun `initialize` function.","Analyzer: L-5, L-16",front-running initialization. seems qa,https://github.com/code-423n4/2024-06-vultisig/blob/main/src/ILOManager.sol#L57-L65
Unsatisfactory,validation-600,,Front-run to block valid projects initialization,"Analyzer: L-5, L-16",front-running initialization. seems qa,https://github.com/code-423n4/2024-06-vultisig/blob/main/src/ILOManager.sol#L57-L65
Unsatisfactory,validation-632,,Attacker can frontrun a project deployment and take ownership,"Analyzer: L-5, L-16",front-running initialization. seems qa,https://github.com/code-423n4/2024-06-vultisig/blob/main/src/ILOManager.sol#L57-L65
Unsatisfactory,validation-633,,"`initProject` is prone to Denial-Of-Service attacks, preventing users from creating new projects","Analyzer: L-5, L-16",front-running initialization. seems qa,https://github.com/code-423n4/2024-06-vultisig/blob/main/src/ILOManager.sol#L57-L65
Unsatisfactory,validation-636,,Project initialization can be DOS'ed,"Analyzer: L-5, L-16",front-running initialization. seems qa,https://github.com/code-423n4/2024-06-vultisig/blob/main/src/ILOManager.sol#L57-L65
Unsatisfactory,validation-640,,"Using `MANAGER = msg.sender` in `initialize()` function of `ILOPool.sol` , can give Managerial access to anyone who calls the contract leading to weak access control vulnerability.","Analyzer: L-5, L-16",front-running initialization. seems qa,https://github.com/code-423n4/2024-06-vultisig/blob/main/src/ILOManager.sol#L57-L65
Unsatisfactory,validation-644,,Front-Running Vulnerability in initProject in ILOmanager Causing Project unable to use ILO Pool,"Analyzer: L-5, L-16",front-running initialization. seems qa,https://github.com/code-423n4/2024-06-vultisig/blob/main/src/ILOManager.sol#L57-L65
Unsatisfactory,validation-651,,"`ILOManager::initProject` can be frontrunned by a malicious user, which might make the entire protocol unusable, and can cause loss of funds.","Analyzer: L-5, L-16",front-running initialization. seems qa,https://github.com/code-423n4/2024-06-vultisig/blob/main/src/ILOManager.sol#L57-L65
Unsatisfactory,validation-666,,Anyone can call function initialize(),"Analyzer: L-5, L-16",front-running initialization. seems qa,https://github.com/code-423n4/2024-06-vultisig/blob/main/src/ILOManager.sol#L57-L65
Unsatisfactory,validation-72,,`ILOManager.sol#initProject` function can be frontrun.,"Analyzer: L-5, L-16",front-running initialization. seems qa,https://github.com/code-423n4/2024-06-vultisig/blob/main/src/ILOManager.sol#L57-L65
Unsatisfactory,validation-28,,Malicious project can set `launchTime` much earlier to bypass `DEFAULT_DEADLINE_OFFSET`,Project admin should be trusted on boundary limits,Lack of check that launchTime is greater than block.timestamp,https://github.com/code-423n4/2024-06-vultisig/blob/main/src/ILOManager.sol#L58
Unsatisfactory,validation-282,,Project's launch time can be set in past ,Project admin should be trusted on boundary limits,Lack of check that launchTime is greater than block.timestamp,https://github.com/code-423n4/2024-06-vultisig/blob/main/src/ILOManager.sol#L58
Unsatisfactory,validation-361,,"In the initProject function, the launchTime check is missing.",Project admin should be trusted on boundary limits,Lack of check that launchTime is greater than block.timestamp,https://github.com/code-423n4/2024-06-vultisig/blob/main/src/ILOManager.sol#L58
Unsatisfactory,validation-480,,Anyone cannot `claimRefund` due to incorrect assumption of `refundDeadline`.,Refund still possible if launch fails,Refund is not possible either before or after launch,"https://github.com/code-423n4/2024-06-vultisig/blob/main/src/ILOManager.sol#L58,https://github.com/code-423n4/2024-06-vultisig/blob/cb72b1e9053c02a58d874ff376359a83dc3f0742/src/ILOPool.sol#L342"
Unsatisfactory,validation-16,,DOS attack prevent initiating new ILOPools,Infeasible,Front-run deterministic deployement,https://github.com/code-423n4/2024-06-vultisig/blob/main/src/ILOManager.sol#L78-L84
Unsatisfactory,validation-199,,Malicious actor can frontrun pool creation by deploying clone at deterministic address,Infeasible,Front-run deterministic deployement,https://github.com/code-423n4/2024-06-vultisig/blob/main/src/ILOManager.sol#L78-L84
Unsatisfactory,validation-260,,Salt used for creating clones is broken,Infeasible,Front-run deterministic deployement,https://github.com/code-423n4/2024-06-vultisig/blob/main/src/ILOManager.sol#L78-L84
Unsatisfactory,validation-300,,Possible front-running griefing attack on `ILOManager::initILOPool`,Infeasible,Front-run deterministic deployement,https://github.com/code-423n4/2024-06-vultisig/blob/main/src/ILOManager.sol#L78-L84
Unsatisfactory,validation-365,,Initing ILO pools is vulnerable to reorg attacks/front run,Infeasible,Front-run deterministic deployement,https://github.com/code-423n4/2024-06-vultisig/blob/main/src/ILOManager.sol#L78-L84
Unsatisfactory,validation-409,,`initILOPool()` may cause front-running griefing attack on NFT creations.,Infeasible,Front-run deterministic deployement,https://github.com/code-423n4/2024-06-vultisig/blob/main/src/ILOManager.sol#L78-L84
Unsatisfactory,validation-45,,Possible griefing attack on the `initILOPool(...)` function due to how `Clones.cloneDeterministic(...)` function is used.,Infeasible,Front-run deterministic deployement,https://github.com/code-423n4/2024-06-vultisig/blob/main/src/ILOManager.sol#L78-L84
Unsatisfactory,validation-531,,Salt creation does not include msg.sender,Infeasible,Front-run deterministic deployement,https://github.com/code-423n4/2024-06-vultisig/blob/main/src/ILOManager.sol#L78-L84
Unsatisfactory,validation-590,,Vulnerability in Deterministic Cloning with Predictable Salt,Infeasible,Front-run deterministic deployement,https://github.com/code-423n4/2024-06-vultisig/blob/main/src/ILOManager.sol#L78-L84
Unsatisfactory,findings-22,,The `sqrtRatioUpperX96` should be greater than the `initialPoolPriceX96` when initializing the `ILOPool` in the `ILOManager.initILOPool`,Low QA on boundary checks (admin call),Incorrect price validation,https://github.com/code-423n4/2024-06-vultisig/blob/main/src/ILOManager.sol#L90
Unsatisfactory,findings-33,,The price range configuration is flawed in `ILOManager.initILOPool`.,Low QA on boundary checks (admin call),Incorrect price validation,https://github.com/code-423n4/2024-06-vultisig/blob/main/src/ILOManager.sol#L90
Unsatisfactory,validation-130,,Missing check for correct pool intialization allows project admin to intialize pool with incorrect price range,Low QA on boundary checks,Incorrect price validation,https://github.com/code-423n4/2024-06-vultisig/blob/main/src/ILOManager.sol#L90
Unsatisfactory,validation-144,,"[M-01] Out-of-range ILOPool can be created, leading to an inactive liquidity position",Low QA on boundary checks,Incorrect price validation,https://github.com/code-423n4/2024-06-vultisig/blob/main/src/ILOManager.sol#L90
Unsatisfactory,validation-149,,Incorrect price limits during the initILOPool process may lead to incorrect pricing.,Low QA on boundary checks,Incorrect price validation,https://github.com/code-423n4/2024-06-vultisig/blob/main/src/ILOManager.sol#L90
Unsatisfactory,validation-207,,Insufficient check for `initialPoolPriceX96 ` ,Low QA on boundary checks,Incorrect price validation,https://github.com/code-423n4/2024-06-vultisig/blob/main/src/ILOManager.sol#L90
Unsatisfactory,validation-323,,Incorrect range validation in `initILOPool()`,Low QA on boundary checks,Incorrect price validation,https://github.com/code-423n4/2024-06-vultisig/blob/main/src/ILOManager.sol#L90
Unsatisfactory,validation-379,,Initial price can be set outside of the price range.,Low QA on boundary checks,Incorrect price validation,https://github.com/code-423n4/2024-06-vultisig/blob/main/src/ILOManager.sol#L90
Unsatisfactory,validation-48,,Wrong initialPoolPriceX96 upper tick comparison,Low QA on boundary checks,Incorrect price validation,https://github.com/code-423n4/2024-06-vultisig/blob/main/src/ILOManager.sol#L90
Unsatisfactory,validation-481,,Invalid pool can be initialized,Intended design,Incorrect price validation,https://github.com/code-423n4/2024-06-vultisig/blob/main/src/ILOManager.sol#L90
Unsatisfactory,validation-623,,initILOPool function allows _project.initialPoolPriceX96 to be more than sqrtRatioUpperX96,Low QA on boundary checks,Incorrect price validation,https://github.com/code-423n4/2024-06-vultisig/blob/main/src/ILOManager.sol#L90
Unsatisfactory,validation-638,,"The function ILOManager.initILOPool() does not successfully check that the given ticks from a user include the current price of the pool, leading to a wrongful allocation of funds.",Low QA on boundary checks,Incorrect price validation,https://github.com/code-423n4/2024-06-vultisig/blob/main/src/ILOManager.sol#L90
Unsatisfactory,validation-648,,Invalid validation for pool price range,Low QA on boundary checks,Incorrect price validation,https://github.com/code-423n4/2024-06-vultisig/blob/main/src/ILOManager.sol#L90
Unsatisfactory,validation-686,,Miscalculate amount of liquidity and amount of token ,Low QA on boundary checks,Incorrect price validation,https://github.com/code-423n4/2024-06-vultisig/blob/main/src/ILOManager.sol#L90
Unsatisfactory,validation-99,,`ILOManager.sol#initILOPool` function has error on validating initial pool price.,Low QA on boundary checks,Incorrect price validation,https://github.com/code-423n4/2024-06-vultisig/blob/main/src/ILOManager.sol#L90
Unsatisfactory,validation-625,,Unsafe use of `_mint` instead of `_safeMint`,Analyzer: M-2,Use safeMint instead of mint. This is QA at best,https://github.com/code-423n4/2024-06-vultisig/blob/main/src/ILOPool.sol#L144
Unsatisfactory,validation-635,,Hardcoded 0 value in tokenOfOwnerByIndex disallows investor from using another tokenId during buy(),Transfer the other to another controlled address then,User can only add liquidity to one position,https://github.com/code-423n4/2024-06-vultisig/blob/main/src/ILOPool.sol#L147
Unsatisfactory,validation-159,,Whitelist doesn't matter,Commonly known issue,Users can bypass max limit by transferring the sale NFT. This seems like QA,https://github.com/code-423n4/2024-06-vultisig/blob/main/src/ILOPool.sol#L151
Unsatisfactory,validation-622,,`Whitelist._maxAddressCap` can be bypassed when claiming `$VULT` tokens,We only add limitations for buy actions via uniswap v3 pool,Users can bypass max limit by transferring the sale NFT. This seems like QA,https://github.com/code-423n4/2024-06-vultisig/blob/main/src/ILOPool.sol#L151
Unsatisfactory,findings-19,,The late claimers are unable to claim their positions because of an incorrect calculation of fees in the function `ILOPool.claim`,Incorrect assumptions,Incorrect computation of fees ,https://github.com/code-423n4/2024-06-vultisig/blob/main/src/ILOPool.sol#L184-L261
Unsatisfactory,findings-40,,Incorrect platformFee calculation for claim function,Incorrect assumptions,Incorrect computation of fees ,https://github.com/code-423n4/2024-06-vultisig/blob/main/src/ILOPool.sol#L184-L261
Unsatisfactory,findings-43,,Most users won't be able to claim their share of Uniswap fees,Incorrect assumptions,Incorrect computation of fees ,https://github.com/code-423n4/2024-06-vultisig/blob/main/src/ILOPool.sol#L184-L261
Unsatisfactory,findings-52,,UniswapV3 protocol fees are unfairly allocated,Incorrect assumptions,Incorrect computation of fees ,https://github.com/code-423n4/2024-06-vultisig/blob/main/src/ILOPool.sol#L184-L261
Unsatisfactory,validation-132,,Inaccurate Fee Calculation May Result in Overcharging or Undercharging,Incorrect assumptions,Incorrect computation of fees ,https://github.com/code-423n4/2024-06-vultisig/blob/main/src/ILOPool.sol#L184-L261
Unsatisfactory,validation-140,,Position owner may not receive accumulated LP fees when they claim liquidity,Incorrect assumptions,Incorrect computation of fees ,https://github.com/code-423n4/2024-06-vultisig/blob/main/src/ILOPool.sol#L184-L261
Unsatisfactory,validation-350,,Incorrect fee distribution in `claim()`,Incorrect assumptions,Incorrect computation of fees ,https://github.com/code-423n4/2024-06-vultisig/blob/main/src/ILOPool.sol#L184-L261
Unsatisfactory,validation-430,,Improper fee distribution mechanism in the `ILOPool.claim()` function.,Incorrect assumptions,Incorrect computation of fees ,https://github.com/code-423n4/2024-06-vultisig/blob/main/src/ILOPool.sol#L184-L261
Unsatisfactory,validation-433,,The fees for the `FEE_TAKER` are not calculated correctly in the [ILOPool.claim](https://github.com/code-423n4/2024-06-vultisig/blob/0957ff9e50441cd6de6b4f6e28c7ea93f5cffa85/src/ILOPool.sol#L184-L261) function,Incorrect assumptions,Incorrect computation of fees ,https://github.com/code-423n4/2024-06-vultisig/blob/main/src/ILOPool.sol#L184-L261
Unsatisfactory,validation-459,,"ILOPool::claim : The amount transfered to the feeTaker is incorrect, which causes the claim function to revert ",Incorrect assumptions,Incorrect computation of fees ,https://github.com/code-423n4/2024-06-vultisig/blob/main/src/ILOPool.sol#L184-L261
Unsatisfactory,validation-460,,ILOPool.claim Sends Excess Fees to FEE_TAKER,Incorrect assumptions,Incorrect computation of fees ,https://github.com/code-423n4/2024-06-vultisig/blob/main/src/ILOPool.sol#L184-L261
Unsatisfactory,validation-490,,Investors in an ILOPool can lose out on their share of LP position Fees earned from Uniswap V3,Incorrect assumptions,Incorrect computation of fees ,https://github.com/code-423n4/2024-06-vultisig/blob/main/src/ILOPool.sol#L184-L261
Unsatisfactory,validation-513,,`claim` function incorrectly assumes that `amount0` and `amount1` returned by `UniswapV3Pool.burn` function exclude swap fees that LP is entitled to,Incorrect assumptions,Incorrect computation of fees ,https://github.com/code-423n4/2024-06-vultisig/blob/main/src/ILOPool.sol#L184-L261
Unsatisfactory,validation-586,,Any subsequent `claim()` after first `claim()` will receive incorrect amount of tokens even could lead to revert operation,Incorrect assumptions,Incorrect computation of fees ,https://github.com/code-423n4/2024-06-vultisig/blob/main/src/ILOPool.sol#L184-L261
Unsatisfactory,validation-414,,User / fee taker blacklisted by token will temporarily prevent fees from being collected for the protocol,Low QA on having an admin address blacklisted,Blacklist fee taker. At best QA I think,https://github.com/code-423n4/2024-06-vultisig/blob/main/src/ILOPool.sol#L259C8-L260C96
Unsatisfactory,validation-601,,Liquidity claims can get DOS'ed if feeTaker address gets blacklisted,Low QA on having an admin address blacklisted,Blacklist fee taker. At best QA I think,https://github.com/code-423n4/2024-06-vultisig/blob/main/src/ILOPool.sol#L259C8-L260C96
Unsatisfactory,findings-30,,The sale token is not deposited to ILOPool.,Inconsequential as this can always be transferred manually into the contract,Owner may not send the tokens to pool contract. QA at best,https://github.com/code-423n4/2024-06-vultisig/blob/main/src/ILOPool.sol#L296-L303
Unsatisfactory,validation-118,,ILOPool can never be launched if project admin doesnt transfer tokens to the pool,Incorrect perceptions,Owner may not send the tokens to pool contract. QA at best,https://github.com/code-423n4/2024-06-vultisig/blob/main/src/ILOPool.sol#L296-L303
Unsatisfactory,validation-121,,SALE_TOKEN is not transfered to ILOPool while creating new pool,Incorrect perceptions. Will be done at launch,Owner may not send the tokens to pool contract. QA at best,https://github.com/code-423n4/2024-06-vultisig/blob/main/src/ILOPool.sol#L296-L303
Unsatisfactory,validation-271,,Pool launch will revert while adding liquidity to uniswap due to lack of sale token,Incorrect perceptions. Project admin will pre-transfer sale tokens to the contract,Owner may not send the tokens to pool contract. QA at best,https://github.com/code-423n4/2024-06-vultisig/blob/main/src/ILOPool.sol#L296-L303
Unsatisfactory,validation-500,,Investors will face opportunity loss if project does not send Sale Tokens,Unlikely to happen as project admin is trusted,Owner may not send the tokens to pool contract. QA at best,https://github.com/code-423n4/2024-06-vultisig/blob/main/src/ILOPool.sol#L296-L303
Unsatisfactory,validation-360,,Incorrect vestingConfig initialisation when lauching pool,Intended because vestingConfigs[i].recipient == address(0) when i=0 in _validateSharesAndVests(),index 0 vesting is skipped,https://github.com/code-423n4/2024-06-vultisig/blob/main/src/ILOPool.sol#L311
Unsatisfactory,validation-270,,"When the admin is blacklisted from the token, the `launch` will fail.",SALE TOKEN is VULT,Owner blacklisted. QA at best,https://github.com/code-423n4/2024-06-vultisig/blob/main/src/ILOPool.sol#L332
Unsatisfactory,validation-516,,"If the admin gets blacklisted by the SALE_TOKEN token (like if USDC/USDT tokens are used), the whole launch process for all ILOPools of a particular pool key will be DoS'ed",SALE TOKEN is VULT,Owner blacklisted. QA at best,https://github.com/code-423n4/2024-06-vultisig/blob/main/src/ILOPool.sol#L332
Unsatisfactory,validation-436,, ILOManager::launch() function breaks the invariant,Intended design,Docs different than code in access control. I think QA,https://github.com/code-423n4/2024-06-vultisig/blob/main/src/ILOPool.sol#L363-L373
Unsatisfactory,validation-526,,"`ILOManager.launch` function is callable by anyone, which breaks invariant that only project admin should be allowed to launch project and all of its ilo pools",Intended design,Docs different than code in access control. I think QA,https://github.com/code-423n4/2024-06-vultisig/blob/main/src/ILOPool.sol#L363-L373
Unsatisfactory,validation-74,,Misconfigured Access Control in `launch` Function,Intended design,Docs different than code in access control. I think QA,https://github.com/code-423n4/2024-06-vultisig/blob/main/src/ILOPool.sol#L363-L373
