status,issue,primary finding,title,validator 1 comment,validator 2 comment,merged root cause
Unsatisfactory,validation-196,,`TickMath.sol` and `FullMath.sol` don't use unchecked.,conditional is in place to prevent over/under flow. unchecked applies only to Solidity 8,Adapt library for compiler. QA at best. ,https://github.com/code-423n4/2024-06-vultisig/blob/main/hardhat-vultisig/contracts/oracles/uniswap/uniswapv0.8/TickMath.sol#L2
Unsatisfactory,validation-211,,[M-01] `TickMath` and `FullMath` libraries are missing `unchecked`,conditional is in place to prevent over/under flow. unchecked applies only to Solidity 8,Adapt library for compiler. QA at best. ,https://github.com/code-423n4/2024-06-vultisig/blob/main/hardhat-vultisig/contracts/oracles/uniswap/uniswapv0.8/TickMath.sol#L2
Unsatisfactory,validation-250,,The FullMath library is unable to handle intermediate overflows due to overflow that's desired but never reached,sqrtRatioAX96 > sqrtRatioBX96 is in place to prevent over/under flow,Adapt library for compiler. QA at best. ,https://github.com/code-423n4/2024-06-vultisig/blob/main/hardhat-vultisig/contracts/oracles/uniswap/uniswapv0.8/TickMath.sol#L2
Unsatisfactory,validation-41,,`TickMath` and `FullMath` libraries might revert in solidity version 0.8,conditional is in place to prevent over/under flow. unchecked applies only to Solidity 8,Adapt library for compiler. QA at best. ,https://github.com/code-423n4/2024-06-vultisig/blob/main/hardhat-vultisig/contracts/oracles/uniswap/uniswapv0.8/TickMath.sol#L2
Unsatisfactory,validation-413,,TickMath can revert in solidity version 0.8,conditional is in place to prevent over/under flow. unchecked applies only to Solidity 8,Adapt library for compiler. QA at best. ,https://github.com/code-423n4/2024-06-vultisig/blob/main/hardhat-vultisig/contracts/oracles/uniswap/uniswapv0.8/TickMath.sol#L2
Unsatisfactory,validation-510,,Use unchecked in TickMath.sol and FullMath.sol,conditional is in place to prevent over/under flow. unchecked applies only to Solidity 8,Adapt library for compiler. QA at best. ,https://github.com/code-423n4/2024-06-vultisig/blob/main/hardhat-vultisig/contracts/oracles/uniswap/uniswapv0.8/TickMath.sol#L2
Unsatisfactory,validation-525,,The function body of getSqrtRatioAtTick() is missing an unchecked block to handle overflows if reached,conditional is in place to prevent over/under flow. unchecked applies only to Solidity 8,Adapt library for compiler. QA at best. ,https://github.com/code-423n4/2024-06-vultisig/blob/main/hardhat-vultisig/contracts/oracles/uniswap/uniswapv0.8/TickMath.sol#L2
Unsatisfactory,validation-530,,The FullMath library is unable to handle intermediate overflows due to overflow that's desired but never reached,sqrtRatioAX96 > sqrtRatioBX96 is in place to prevent over/under flow,Adapt library for compiler. QA at best. ,https://github.com/code-423n4/2024-06-vultisig/blob/main/hardhat-vultisig/contracts/oracles/uniswap/uniswapv0.8/TickMath.sol#L2
Unsatisfactory,validation-569,,Missing Unchecked Arithmetic Leading to DoS in `UniswapV3Oracle`,conditional is in place to prevent over/under flow. unchecked applies only to Solidity 8,Adapt library for compiler. QA at best. ,https://github.com/code-423n4/2024-06-vultisig/blob/main/hardhat-vultisig/contracts/oracles/uniswap/uniswapv0.8/TickMath.sol#L2
Unsatisfactory,validation-616,,Use unchecked in SqrtPriceMathPartial.sol,conditional is in place to prevent over/under flow. unchecked applies only to Solidity 8,Adapt library for compiler. QA at best. ,https://github.com/code-423n4/2024-06-vultisig/blob/main/hardhat-vultisig/contracts/oracles/uniswap/uniswapv0.8/TickMath.sol#L2
Unsatisfactory,validation-656,,`TickMath` `OracleLibrary` and `FullMath` libraries are missing `unchecked`,conditional is in place to prevent over/under flow. unchecked applies only to Solidity 8,Adapt library for compiler. QA at best. ,https://github.com/code-423n4/2024-06-vultisig/blob/main/hardhat-vultisig/contracts/oracles/uniswap/uniswapv0.8/TickMath.sol#L2
Unsatisfactory,validation-8,,Forked Uniswap libraries not optimized for solc version which can DOS protocol operations.,conditional is in place to prevent over/under flow. unchecked applies only to Solidity 8,Adapt library for compiler. QA at best. ,https://github.com/code-423n4/2024-06-vultisig/blob/main/hardhat-vultisig/contracts/oracles/uniswap/uniswapv0.8/TickMath.sol#L2
Unsatisfactory,validation-104,,TWAP Window should be configurable,Circumvented by the ternary: uint32 period = PERIOD < longestPeriod ? PERIOD : longestPeriod,"TWAP window should be flexible. Seems like QA, as twap window seems to be max 30 minutes and not 30 minutes as constant",https://github.com/code-423n4/2024-06-vultisig/blob/main/hardhat-vultisig/contracts/oracles/uniswap/UniswapV3Oracle.sol#L16
Unsatisfactory,validation-408,,TWAP period should not be constant ,Circumvented by the ternary: uint32 period = PERIOD < longestPeriod ? PERIOD : longestPeriod,"TWAP window should be flexible. Seems like QA, as twap window seems to be max 30 minutes and not 30 minutes as constant",https://github.com/code-423n4/2024-06-vultisig/blob/main/hardhat-vultisig/contracts/oracles/uniswap/UniswapV3Oracle.sol#L16
Unsatisfactory,validation-499,,Current PERIOD implementation could lead to swapping scenario where user could swap at an inflation rate.,Inadequate proof,"TWAP window should be flexible. Seems like QA, as twap window seems to be max 30 minutes and not 30 minutes as constant",https://github.com/code-423n4/2024-06-vultisig/blob/main/hardhat-vultisig/contracts/oracles/uniswap/UniswapV3Oracle.sol#L16
Unsatisfactory,validation-501,,TWAP Oracle inflexible PERIOD,Circumvented by the ternary: uint32 period = PERIOD < longestPeriod ? PERIOD : longestPeriod,"TWAP window should be flexible. Seems like QA, as twap window seems to be max 30 minutes and not 30 minutes as constant",https://github.com/code-423n4/2024-06-vultisig/blob/main/hardhat-vultisig/contracts/oracles/uniswap/UniswapV3Oracle.sol#L16
Unsatisfactory,validation-102,,Incorrect TWAP price returned by UniswapV3Oracle.sol,Known and intended,TWAP window maybe smaller than 30 minutes,https://github.com/code-423n4/2024-06-vultisig/blob/main/hardhat-vultisig/contracts/oracles/uniswap/UniswapV3Oracle.sol#L41
Unsatisfactory,validation-304,,TWAP price is calculated for timeframe less than the min 30 mins ,Known and intended,TWAP window maybe smaller than 30 minutes,https://github.com/code-423n4/2024-06-vultisig/blob/main/hardhat-vultisig/contracts/oracles/uniswap/UniswapV3Oracle.sol#L41
Unsatisfactory,validation-77,,Unstable TWAP will be returned when the pool is just launched,Known and intended,TWAP window maybe smaller than 30 minutes,https://github.com/code-423n4/2024-06-vultisig/blob/main/hardhat-vultisig/contracts/oracles/uniswap/UniswapV3Oracle.sol#L41
Unsatisfactory,validation-12,,Burning functionality is missing in Vultisig contract,Intended design via parental burn(),Mismatch docs and code regarding burn mechanism. At best QA,https://github.com/code-423n4/2024-06-vultisig/blob/main/hardhat-vultisig/contracts/Vultisig.sol#L11
Unsatisfactory,validation-125,,Inconsistency in Token Burn Functionality of `Vultisig` Contract,Intended design via parental burn(),Mismatch docs and code regarding burn mechanism. At best QA,https://github.com/code-423n4/2024-06-vultisig/blob/main/hardhat-vultisig/contracts/Vultisig.sol#L11
Unsatisfactory,validation-147,,VULT lacks burn function,Intended design via parental burn(),Mismatch docs and code regarding burn mechanism. At best QA,https://github.com/code-423n4/2024-06-vultisig/blob/main/hardhat-vultisig/contracts/Vultisig.sol#L11
Unsatisfactory,validation-392,,Vultisig should be burnable,Intended design via parental burn(),Mismatch docs and code regarding burn mechanism. At best QA,https://github.com/code-423n4/2024-06-vultisig/blob/main/hardhat-vultisig/contracts/Vultisig.sol#L11
Unsatisfactory,validation-418,,M-1 There is no external function `burn()` in the VULT contract,Intended design,Mismatch docs and code regarding burn mechanism. At best QA,https://github.com/code-423n4/2024-06-vultisig/blob/main/hardhat-vultisig/contracts/Vultisig.sol#L11
Unsatisfactory,validation-462,,Internal _burn() function is not exposed externally in the Vultisig.sol contract,Intended design via parental burn(),Mismatch docs and code regarding burn mechanism. At best QA,https://github.com/code-423n4/2024-06-vultisig/blob/main/hardhat-vultisig/contracts/Vultisig.sol#L11
Unsatisfactory,validation-171,,Lack of Blacklist Check When Adding Whitelisted Addresses,Inconsequential,Address might be blacklisted and whitelisted at the same time. Seems QA owner mistake,https://github.com/code-423n4/2024-06-vultisig/blob/main/hardhat-vultisig/contracts/Whitelist.sol#L185-L187
Unsatisfactory,validation-400,,Address can be blacklisted and whitelisted at the same time ,Inconsequential,Address might be blacklisted and whitelisted at the same time. Seems QA owner mistake,https://github.com/code-423n4/2024-06-vultisig/blob/main/hardhat-vultisig/contracts/Whitelist.sol#L185-L187
Unsatisfactory,validation-534,,Inconsistencies in blacklist and whitelist mappings.,Inadequate elaboration. Inconsequential,Address might be blacklisted and whitelisted at the same time. Seems QA owner mistake,https://github.com/code-423n4/2024-06-vultisig/blob/main/hardhat-vultisig/contracts/Whitelist.sol#L185-L187
Unsatisfactory,validation-523,,VultisigWhitelisted Contract Vulnerable to Whitelist Bypass,Low QA on uninitialized variable,Vultisig whitelisting can be bypassed by anyone,https://github.com/code-423n4/2024-06-vultisig/blob/main/hardhat-vultisig/contracts/Whitelist.sol#L204-L228
Unsatisfactory,validation-33,,Manipulatable contributed amount of `VULT`,We only add limitations for buy actions via uniswap v3 pool,Inflate contribution ,https://github.com/code-423n4/2024-06-vultisig/blob/main/hardhat-vultisig/contracts/Whitelist.sol#L204C5-L206C14
Unsatisfactory,findings-50,,Treasury can't claim liquidity while the whitelist is active,claim isn't buy,Treasury should be allowed to claim liquidity at any moment. This seems QA,https://github.com/code-423n4/2024-06-vultisig/blob/main/hardhat-vultisig/contracts/Whitelist.sol#L205
Unsatisfactory,validation-241,,Blacklisting can be easily bypassed because of insufficient check.,Commonly known issue,Funds can be transferred to black-listed address. This is QA at best,https://github.com/code-423n4/2024-06-vultisig/blob/main/hardhat-vultisig/contracts/Whitelist.sol#L205
Unsatisfactory,validation-256,,Blacklisted Addresses Can Bypass Restrictions by Purchasing Tokens for Whitelisted Addresses,onlyVultisig,Funds can be transferred to black-listed address. This is QA at best,https://github.com/code-423n4/2024-06-vultisig/blob/main/hardhat-vultisig/contracts/Whitelist.sol#L205
Unsatisfactory,validation-588,,Max contribution cap check might freeze user's liquidity in Uniswap pool,We only add limitations for buy actions via uniswap v3 pool,VAULT token price high can prevent claiming,https://github.com/code-423n4/2024-06-vultisig/blob/main/hardhat-vultisig/contracts/Whitelist.sol#L222
Unsatisfactory,validation-624,,Investors might not be able to claim their `$VULT` sale tokens if priced high,We only add limitations for buy actions via uniswap v3 pool,VAULT token price high can prevent claiming,https://github.com/code-423n4/2024-06-vultisig/blob/main/hardhat-vultisig/contracts/Whitelist.sol#L222
Unsatisfactory,validation-675,,"Vultisig token transfers can be Dossed, preventing users from receiving them.",Commonly known issue,VAULT token price high can prevent claiming,https://github.com/code-423n4/2024-06-vultisig/blob/main/hardhat-vultisig/contracts/Whitelist.sol#L222
Unsatisfactory,findings-13,,"_IsSelfWhitelistDisabled defaults to false, and users may get the whitelist first",Intended design,Variable not initialized allows whitelist front-running,"https://github.com/code-423n4/2024-06-vultisig/blob/main/hardhat-vultisig/contracts/Whitelist.sol#L29,https://github.com/code-423n4/2024-06-vultisig/blob/main/hardhat-vultisig/contracts/Whitelist.sol#L48-L51"
Unsatisfactory,findings-47,,Users can silently whitelist themselves without admins noticing it,Intended design. Owner can increase allowedWhitelistedIndex by blacklistedCount,Variable not initialized allows whitelist front-running,"https://github.com/code-423n4/2024-06-vultisig/blob/main/hardhat-vultisig/contracts/Whitelist.sol#L29,https://github.com/code-423n4/2024-06-vultisig/blob/main/hardhat-vultisig/contracts/Whitelist.sol#L48-L51"
Unsatisfactory,validation-113,,Whitelisting available on deploy for anyone.,Intended design. Owner can increase allowedWhitelistedIndex by blacklistedCount,Variable not initialized allows whitelist front-running,"https://github.com/code-423n4/2024-06-vultisig/blob/main/hardhat-vultisig/contracts/Whitelist.sol#L29,https://github.com/code-423n4/2024-06-vultisig/blob/main/hardhat-vultisig/contracts/Whitelist.sol#L48-L51"
Unsatisfactory,validation-316,,Whitelist Griefing With Dust in `Whitelist.sol` when `_isSelfWhitelistDisabled` is False.,Intended design. Owner can increase allowedWhitelistedIndex by blacklistedCount,Variable not initialized allows whitelist front-running,"https://github.com/code-423n4/2024-06-vultisig/blob/main/hardhat-vultisig/contracts/Whitelist.sol#L29,https://github.com/code-423n4/2024-06-vultisig/blob/main/hardhat-vultisig/contracts/Whitelist.sol#L48-L51"
Unsatisfactory,validation-444,,Unsetting `self-whitelist` on construction allows Attackers to whitelist themselves even if the Project plan was to disable self-whitelist,Intended design,Variable not initialized allows whitelist front-running,"https://github.com/code-423n4/2024-06-vultisig/blob/main/hardhat-vultisig/contracts/Whitelist.sol#L29,https://github.com/code-423n4/2024-06-vultisig/blob/main/hardhat-vultisig/contracts/Whitelist.sol#L48-L51"
Unsatisfactory,validation-485,,Missing _selfWhitelistDisabled = true in constructor allows anyone to receive a guaranteed spot in whitelist,Intended design,Variable not initialized allows whitelist front-running,"https://github.com/code-423n4/2024-06-vultisig/blob/main/hardhat-vultisig/contracts/Whitelist.sol#L29,https://github.com/code-423n4/2024-06-vultisig/blob/main/hardhat-vultisig/contracts/Whitelist.sol#L48-L51"
Unsatisfactory,validation-552,,Users can whitelist post-deployment by sending ETH,Intended design. Owner can increase allowedWhitelistedIndex by blacklistedCount,Variable not initialized allows whitelist front-running,"https://github.com/code-423n4/2024-06-vultisig/blob/main/hardhat-vultisig/contracts/Whitelist.sol#L29,https://github.com/code-423n4/2024-06-vultisig/blob/main/hardhat-vultisig/contracts/Whitelist.sol#L48-L51"
Unsatisfactory,findings-18,,Non-malicious users can be griefed from getting whitelisted,Intended design. Owner can increase allowedWhitelistedIndex by blacklistedCount,Self-whitelisting sybil attack,https://github.com/code-423n4/2024-06-vultisig/blob/main/hardhat-vultisig/contracts/Whitelist.sol#L72
Unsatisfactory,validation-148,,The attacker can seize all whitelists,Intended design. Owner can increase allowedWhitelistedIndex by blacklistedCount,Self-whitelisting sybil attack,https://github.com/code-423n4/2024-06-vultisig/blob/main/hardhat-vultisig/contracts/Whitelist.sol#L72
Unsatisfactory,validation-406,,_isSelfWhitelistDisabled Vulnerable to Sybil Attacks,Intended design. Owner can increase allowedWhitelistedIndex by blacklistedCount,Self-whitelisting sybil attack,https://github.com/code-423n4/2024-06-vultisig/blob/main/hardhat-vultisig/contracts/Whitelist.sol#L72
Unsatisfactory,validation-498,,Attacker can make 0 msg.value receive() function calls to spam the whitelist,Intended design. Owner can increase allowedWhitelistedIndex by blacklistedCount,Self-whitelisting sybil attack,https://github.com/code-423n4/2024-06-vultisig/blob/main/hardhat-vultisig/contracts/Whitelist.sol#L72
Unsatisfactory,validation-55,,Whitelist can be indefinitely bricked by adding large amount of addresses using `receive()` to self whitelist,Intended design. Owner can increase allowedWhitelistedIndex by blacklistedCount,Self-whitelisting sybil attack,https://github.com/code-423n4/2024-06-vultisig/blob/main/hardhat-vultisig/contracts/Whitelist.sol#L72
Unsatisfactory,validation-619,,Self-whitelist with ETH transfer via `Whitelist::receive` can be easily abused to cause Denial-of-service (DOS) on token transfers during whitelist period,Intended design. Owner can increase allowedWhitelistedIndex by blacklistedCount,Self-whitelisting sybil attack,https://github.com/code-423n4/2024-06-vultisig/blob/main/hardhat-vultisig/contracts/Whitelist.sol#L72
Unsatisfactory,validation-669,,Selfwhitelisting option combined with allowedWhitelistedIndex would result in restricting legit addresses,Intended design. Owner can increase allowedWhitelistedIndex by blacklistedCount,Self-whitelisting sybil attack,https://github.com/code-423n4/2024-06-vultisig/blob/main/hardhat-vultisig/contracts/Whitelist.sol#L72
Unsatisfactory,validation-681,,Attackers can make users not allowed for whitelist when Self Whitelist gets enabled,Intended design. Owner can increase allowedWhitelistedIndex by blacklistedCount,Self-whitelisting sybil attack,https://github.com/code-423n4/2024-06-vultisig/blob/main/hardhat-vultisig/contracts/Whitelist.sol#L72
Unsatisfactory,validation-188,,Multisig Wallets Cannot Get White-listed Due to the `transfer()` Function Gas Constraint,Low QA frequently reported by the bots,No support for contracts to be self-whitelisted. QA at best,https://github.com/code-423n4/2024-06-vultisig/blob/main/hardhat-vultisig/contracts/Whitelist.sol#L73
Unsatisfactory,validation-201,,Use call() instead of transfer() when transferring ETH in Whitelist.sol,Low QA frequently reported by the bots,No support for contracts to be self-whitelisted. QA at best,https://github.com/code-423n4/2024-06-vultisig/blob/main/hardhat-vultisig/contracts/Whitelist.sol#L73
Unsatisfactory,validation-203,,"`Whitelist:: receive` uses `transfer` to handle eth transfer, which will fail for smart accounts, multisig wallets",Low QA frequently reported by the bots,No support for contracts to be self-whitelisted. QA at best,https://github.com/code-423n4/2024-06-vultisig/blob/main/hardhat-vultisig/contracts/Whitelist.sol#L73
Unsatisfactory,validation-443,,using `transfer()` instead of `call()` prevents Smart Contract Wallets from Self-whitelisting,Low QA frequently reported by the bots,No support for contracts to be self-whitelisted. QA at best,https://github.com/code-423n4/2024-06-vultisig/blob/main/hardhat-vultisig/contracts/Whitelist.sol#L73
Unsatisfactory,validation-449,,Use `address.call{value:x}()` instead of `payable.transfer()`.,Low QA frequently reported by the bots,No support for contracts to be self-whitelisted. QA at best,https://github.com/code-423n4/2024-06-vultisig/blob/main/hardhat-vultisig/contracts/Whitelist.sol#L73
Unsatisfactory,validation-452,,Using transfer instead of low level call,Low QA frequently reported by the bots,No support for contracts to be self-whitelisted. QA at best,https://github.com/code-423n4/2024-06-vultisig/blob/main/hardhat-vultisig/contracts/Whitelist.sol#L73
Unsatisfactory,validation-484,,Self-whitelist doesn't work if msg.sender is a contract,Low QA frequently reported by the bots,No support for contracts to be self-whitelisted. QA at best,https://github.com/code-423n4/2024-06-vultisig/blob/main/hardhat-vultisig/contracts/Whitelist.sol#L73
Unsatisfactory,validation-52,,Possible denial of service when Self-whitelisting with smart contract account ,Low QA frequently reported by the bots,No support for contracts to be self-whitelisted. QA at best,https://github.com/code-423n4/2024-06-vultisig/blob/main/hardhat-vultisig/contracts/Whitelist.sol#L73
Unsatisfactory,validation-642,,transfer(...) function in Whitelist(...) can be replaced by a direct call,Low QA frequently reported by the bots,No support for contracts to be self-whitelisted. QA at best,https://github.com/code-423n4/2024-06-vultisig/blob/main/hardhat-vultisig/contracts/Whitelist.sol#L73
Unsatisfactory,validation-66,,Use of solidity's .transfer makes self-whitelisting inaccessible to smart wallets like Safe,Low QA frequently reported by the bots,No support for contracts to be self-whitelisted. QA at best,https://github.com/code-423n4/2024-06-vultisig/blob/main/hardhat-vultisig/contracts/Whitelist.sol#L73
Unsatisfactory,validation-668,,Avoid using of transfer(),Low QA frequently reported by the bots,No support for contracts to be self-whitelisted. QA at best,https://github.com/code-423n4/2024-06-vultisig/blob/main/hardhat-vultisig/contracts/Whitelist.sol#L73
Unsatisfactory,validation-71,,Risky use of `transfer` during self whitelist,Low QA frequently reported by the bots,No support for contracts to be self-whitelisted. QA at best,https://github.com/code-423n4/2024-06-vultisig/blob/main/hardhat-vultisig/contracts/Whitelist.sol#L73
Unsatisfactory,validation-73,,`call()` should be used instead of `transfer()` when transferring ETH,Low QA frequently reported by the bots,No support for contracts to be self-whitelisted. QA at best,https://github.com/code-423n4/2024-06-vultisig/blob/main/hardhat-vultisig/contracts/Whitelist.sol#L73
Unsatisfactory,validation-273,,The schedules can be overlapped due to improper check.,Working as intended as circumvented by lastEnd. Project admin should not commit such mistakes,Owner mistake in setting start and end. QA at best.,https://github.com/code-423n4/2024-06-vultisig/blob/main/src/base/ILOVest.sol#L41-L48
Unsatisfactory,validation-546,,`ILOVest`'s vest schedule is incorrectly validated which breaks key invariant of Vesting,Working as intended as circumvented by lastEnd. Project admin should not commit such mistakes,Owner mistake in setting start and end. QA at best.,https://github.com/code-423n4/2024-06-vultisig/blob/main/src/base/ILOVest.sol#L41-L48
Unsatisfactory,validation-649,,Lack of proper validation makes it possible to start a pool with a start and end date that is in the past ,Unlikely to happen,Owner mistake in setting start and end. QA at best.,https://github.com/code-423n4/2024-06-vultisig/blob/main/src/base/ILOVest.sol#L41-L48
Unsatisfactory,validation-366,,"Missing vesting end date check on `ILOVest::_validateVestSchedule` leads to pool creations with unfair vesting schedule for investors, allowing a project team member to claim the his part of the raised tokens instantly after the vesting period starts",Working as intended as circumvented by lastEnd,Incomplete schedule validation allowing owner to have an unfair vesting,https://github.com/code-423n4/2024-06-vultisig/blob/main/src/base/ILOVest.sol#L43
Unsatisfactory,validation-314,,Missing Percentage Checks on `ILOManager::setPlatformFee` & `ILOManager::setPerformanceFee`,Low QA on boundary checks,Owner mistake while setting fees. QA at best,https://github.com/code-423n4/2024-06-vultisig/blob/main/src/ILOManager.sol#L149-L157
Unsatisfactory,findings-24,,DoS: The `initProject` function can be subject to a denial-of-service (DoS) attack if a malicious attacker creates a `WETH/VULT` pool on Uniswap V3 and initializes the initial price incorrectly earlier.,"Analyzer: L-5, L-16",Pool already exists with different price,https://github.com/code-423n4/2024-06-vultisig/blob/main/src/ILOManager.sol#L190
Unsatisfactory,findings-46,,ILO pool launches can be prevented by initializing the pool or the project beforehand,"Analyzer: L-5, L-16",Pool already exists with different price,https://github.com/code-423n4/2024-06-vultisig/blob/main/src/ILOManager.sol#L190
Unsatisfactory,findings-7,,Projects that want to create an ILO sale via the ILOManager contract will be dosed,"Analyzer: L-5, L-16",Pool already exists with different price,https://github.com/code-423n4/2024-06-vultisig/blob/main/src/ILOManager.sol#L190
Unsatisfactory,validation-150,,initProject may be blocked by attacker,Intended design,Pool already exists with different price,https://github.com/code-423n4/2024-06-vultisig/blob/main/src/ILOManager.sol#L190
Unsatisfactory,validation-371,,Potential DoS Vulnerability in Uniswap v3 Pool Initialization,"Analyzer: L-5, L-16",Pool already exists with different price,https://github.com/code-423n4/2024-06-vultisig/blob/main/src/ILOManager.sol#L190
Unsatisfactory,validation-453,,initProject() can be DOSed if the project is for existing UniV3 pool,"Analyzer: L-5, L-16",Pool already exists with different price,https://github.com/code-423n4/2024-06-vultisig/blob/main/src/ILOManager.sol#L190
Unsatisfactory,validation-487,,A project can't be initialized if `saleToken/raiseToken` pool is created earlier,"Analyzer: L-5, L-16",Pool already exists with different price,https://github.com/code-423n4/2024-06-vultisig/blob/main/src/ILOManager.sol#L190
Unsatisfactory,validation-597,,Invalid validation prevents admin of project from initializing price,"Analyzer: L-5, L-16",Pool already exists with different price,https://github.com/code-423n4/2024-06-vultisig/blob/main/src/ILOManager.sol#L190
Unsatisfactory,validation-672,,DOS in project initialization due to price slippage,Intended design,Pool already exists with different price,https://github.com/code-423n4/2024-06-vultisig/blob/main/src/ILOManager.sol#L190
Unsatisfactory,findings-49,,New ILO Pools can be initialized for a project that has ongoing sales affecting its previous buyers,Admin is trusted,several DoS vector for pool launch,https://github.com/code-423n4/2024-06-vultisig/blob/main/src/ILOManager.sol#L193C9-L195C10
